[
  {
    "title": "FDP Demo: Multi-center Imaging Study",
    "institution": "Brane Research Institute",
    "email": "owner@example.org",
    "objective": "Evaluate federated training on anonymized imaging and EHR metadata across three hospitals to predict outcomes.",
    "data_types": ["Imaging", "EHR"],
    "sensitivity": "Medium",
    "security_measures": ["Encryption", "Secure Containers", "Access Logs"],
    "result_sharing": "Aggregate metrics (AUC, loss curves) will be shared. No raw data will leave institutions.",
    "responsibilities": "Each site ensures proper pseudonymization, access logging, and timely updates.",
    "legal_basis": "GDPR Consent",
    "third_party": "no"
  },
  {
    "title": "Federated Genomics Association Study",
    "institution": "GenomeCollab Consortium",
    "email": "pi@genomecollab.org",
    "objective": "Assess genome-wide associations for cardiovascular risk using privacy-preserving FL across biobanks.",
    "data_types": ["Genomics", "EHR"],
    "sensitivity": "High",
    "security_measures": ["Encryption", "Secure Containers", "Pseudonymization", "Access Logs"],
    "result_sharing": "Only aggregated statistics and Manhattan plots will be shared.",
    "responsibilities": "Participating sites will control access, review audits, and maintain secure runtimes.",
    "legal_basis": "Research with Waiver",
    "third_party": "yes"
  },
  {
    "title": "Wearable Sensor FL Benchmark",
    "institution": "U City Health Lab",
    "email": "contact@uchealthlab.edu",
    "objective": "Benchmark FL algorithms on wearable activity and vitals data for early anomaly detection.",
    "data_types": ["Wearables", "EHR"],
    "sensitivity": "Medium",
    "security_measures": ["Encryption", "Access Logs"],
    "result_sharing": "Aggregated metrics and ablation summaries only.",
    "responsibilities": "Maintain device data pipelines and provide incident reporting within 72 hours.",
    "legal_basis": "HIPAA TPO",
    "third_party": "no"
  }
]